{
  "manifest_version": 1,
  "suite_id": "pdf-tools.extraction.phase0",
  "suite_version": "v0.1.0",
  "claim_boundary": "Synthetic local direct-tool calibration only. No model, host UI, external dataset, OCR engine, table engine, or general structured extractor is evaluated.",
  "evaluation_policy": {
    "evidence_bbox": {
      "minimum_iou": 0.5,
      "minimum_truth_containment": 0.9,
      "maximum_page_area_ratio": 0.25
    }
  },
  "fixtures": [
    {
      "id": "pdf-tools.extraction.phase0.born-digital-flat",
      "path": "synthetic/born-digital-flat.pdf",
      "sha256": "706dcc669a763bc88852eff3bfdf3ee428d3ff1dac01b85e2b60942e907d5403",
      "media_type": "application/pdf",
      "partition": "development",
      "category": "flat_schema",
      "description": "Single-page born-digital invoice with a small nested target schema.",
      "provenance": { "kind": "synthetic", "origin": "Open Document Alliance PDF Tools Phase 0 generator", "generator": "scripts/eval-generate-extraction-fixtures.mjs", "source_url": null },
      "license": { "name": "MIT License", "spdx_id": "MIT", "url": "https://opensource.org/license/mit", "redistribution": "allowed" },
      "privacy": { "class": "synthetic", "contains_personal_data": false, "notes": "Fictional organization and identifiers only." },
      "target_schema": { "type": "object", "additionalProperties": false, "required": ["invoice_id", "vendor", "invoice_date", "total"], "properties": { "invoice_id": { "type": "string" }, "vendor": { "type": "string" }, "invoice_date": { "type": "string" }, "total": { "type": "object", "additionalProperties": false, "required": ["currency", "amount"], "properties": { "currency": { "const": "USD" }, "amount": { "type": "number" } } } } },
      "ground_truth": { "invoice_id": "INV-1001", "vendor": "Northwind Paper", "invoice_date": "2026-07-15", "total": { "currency": "USD", "amount": 42.5 } },
      "expected": {
        "pages": [{ "page": 1, "modality": "born_digital", "transcript": "SYNTHETIC INVOICE Invoice ID: INV-1001 Vendor: Northwind Paper Invoice date: 2026-07-15 Total: USD 42.50", "ordered_fragments": ["Invoice ID: INV-1001", "Vendor: Northwind Paper", "Invoice date: 2026-07-15", "Total: USD 42.50"] }],
        "page_geometry": [{ "page": 1, "width": 612, "height": 792, "rotation": 0, "media_box": { "x": 0, "y": 0, "width": 612, "height": 792 }, "crop_box": { "x": 0, "y": 0, "width": 612, "height": 792 } }],
        "facts": [
          { "id": "fact.flat.invoice-id", "field_path": "/invoice_id", "anchor_text": "INV-1001", "page": 1, "bbox": { "x": 72, "y": 78, "width": 190, "height": 30, "coordinate_space": "top_left_pdf_points" }, "important": true },
          { "id": "fact.flat.total", "field_path": "/total", "anchor_text": "USD 42.50", "page": 1, "bbox": { "x": 72, "y": 162, "width": 170, "height": 30, "coordinate_space": "top_left_pdf_points" }, "important": true }
        ],
        "table": null,
        "answer_state": "answerable"
      }
    },
    {
      "id": "pdf-tools.extraction.phase0.born-digital-nested",
      "path": "synthetic/born-digital-nested.pdf",
      "sha256": "c9baaed165000f0e7112e2bfc89e070e0bda26c7ce3f1f16b0dbeebb67e9f11f",
      "media_type": "application/pdf",
      "partition": "development",
      "category": "nested_schema",
      "description": "Born-digital record with nested address, array, and boolean fields.",
      "provenance": { "kind": "synthetic", "origin": "Open Document Alliance PDF Tools Phase 0 generator", "generator": "scripts/eval-generate-extraction-fixtures.mjs", "source_url": null },
      "license": { "name": "MIT License", "spdx_id": "MIT", "url": "https://opensource.org/license/mit", "redistribution": "allowed" },
      "privacy": { "class": "synthetic", "contains_personal_data": false, "notes": "Fictional business record only." },
      "target_schema": { "type": "object", "additionalProperties": false, "required": ["customer_id", "organization", "address", "tags", "active"], "properties": { "customer_id": { "type": "string" }, "organization": { "type": "string" }, "address": { "type": "object", "additionalProperties": false, "required": ["street", "city", "region", "postal_code"], "properties": { "street": { "type": "string" }, "city": { "type": "string" }, "region": { "type": "string" }, "postal_code": { "type": "string" } } }, "tags": { "type": "array", "items": { "type": "string" } }, "active": { "type": "boolean" } } },
      "ground_truth": { "customer_id": "C-204", "organization": "Alpine Works", "address": { "street": "77 Cedar Avenue", "city": "Portland", "region": "OR", "postal_code": "97205" }, "tags": ["renewal", "priority"], "active": true },
      "expected": {
        "pages": [{ "page": 1, "modality": "born_digital", "transcript": "SYNTHETIC CUSTOMER RECORD Customer ID: C-204 Organization: Alpine Works Street: 77 Cedar Avenue City: Portland Region: OR Postal code: 97205 Tags: renewal, priority Active: yes", "ordered_fragments": ["Customer ID: C-204", "Organization: Alpine Works", "Street: 77 Cedar Avenue", "City: Portland", "Region: OR", "Postal code: 97205", "Tags: renewal, priority", "Active: yes"] }],
        "page_geometry": [{ "page": 1, "width": 612, "height": 792, "rotation": 0, "media_box": { "x": 0, "y": 0, "width": 612, "height": 792 }, "crop_box": { "x": 0, "y": 0, "width": 612, "height": 792 } }],
        "facts": [
          { "id": "fact.nested.customer", "field_path": "/customer_id", "anchor_text": "C-204", "page": 1, "bbox": { "x": 72, "y": 78, "width": 170, "height": 30, "coordinate_space": "top_left_pdf_points" }, "important": true },
          { "id": "fact.nested.postal", "field_path": "/address/postal_code", "anchor_text": "97205", "page": 1, "bbox": { "x": 72, "y": 218, "width": 170, "height": 30, "coordinate_space": "top_left_pdf_points" }, "important": true }
        ],
        "table": null,
        "answer_state": "answerable"
      }
    },
    {
      "id": "pdf-tools.extraction.phase0.two-column-order",
      "path": "synthetic/two-column-order.pdf",
      "sha256": "aaaae6795676db9e33f79e75f4662808ee9646f8f2bb12a319f74e3edb11c101",
      "media_type": "application/pdf",
      "partition": "development",
      "category": "layout_order",
      "description": "Two-column born-digital notice with an explicit logical reading order.",
      "provenance": { "kind": "synthetic", "origin": "Open Document Alliance PDF Tools Phase 0 generator", "generator": "scripts/eval-generate-extraction-fixtures.mjs", "source_url": null },
      "license": { "name": "MIT License", "spdx_id": "MIT", "url": "https://opensource.org/license/mit", "redistribution": "allowed" },
      "privacy": { "class": "synthetic", "contains_personal_data": false, "notes": "Synthetic notice text only." },
      "target_schema": { "type": "object", "additionalProperties": false, "required": ["events"], "properties": { "events": { "type": "array", "items": { "type": "string" }, "minItems": 4, "maxItems": 4 } } },
      "ground_truth": { "events": ["Coverage begins July 1.", "Claims close July 31.", "Review starts August 2.", "Decision follows review."] },
      "expected": {
        "pages": [{ "page": 1, "modality": "born_digital", "transcript": "TWO COLUMN NOTICE LEFT-1 Coverage begins July 1. LEFT-2 Claims close July 31. RIGHT-1 Review starts August 2. RIGHT-2 Decision follows review.", "ordered_fragments": ["LEFT-1 Coverage begins July 1.", "LEFT-2 Claims close July 31.", "RIGHT-1 Review starts August 2.", "RIGHT-2 Decision follows review."] }],
        "page_geometry": [{ "page": 1, "width": 612, "height": 792, "rotation": 0, "media_box": { "x": 0, "y": 0, "width": 612, "height": 792 }, "crop_box": { "x": 0, "y": 0, "width": 612, "height": 792 } }],
        "facts": [{ "id": "fact.columns.review", "field_path": "/events/2", "anchor_text": "Review starts August 2.", "page": 1, "bbox": { "x": 326, "y": 100, "width": 230, "height": 30, "coordinate_space": "top_left_pdf_points" }, "important": true }],
        "table": null,
        "answer_state": "answerable"
      }
    },
    {
      "id": "pdf-tools.extraction.phase0.table-merged-blank",
      "path": "synthetic/table-merged-blank.pdf",
      "sha256": "370dc0ac71939cba9db8584327c87899716dc770ac9ee8cad33fc27b5e73b73c",
      "media_type": "application/pdf",
      "partition": "development",
      "category": "table",
      "description": "Ruled table with a merged title cell and an intentional blank cell.",
      "provenance": { "kind": "synthetic", "origin": "Open Document Alliance PDF Tools Phase 0 generator", "generator": "scripts/eval-generate-extraction-fixtures.mjs", "source_url": null },
      "license": { "name": "MIT License", "spdx_id": "MIT", "url": "https://opensource.org/license/mit", "redistribution": "allowed" },
      "privacy": { "class": "synthetic", "contains_personal_data": false, "notes": "Synthetic purchase rows only." },
      "target_schema": { "type": "object", "additionalProperties": false, "required": ["title", "headers", "rows"], "properties": { "title": { "type": "string" }, "headers": { "type": "array", "items": { "type": "string" } }, "rows": { "type": "array", "items": { "type": "object", "additionalProperties": false, "required": ["item", "qty", "amount"], "properties": { "item": { "type": "string" }, "qty": { "anyOf": [{ "type": "integer" }, { "type": "null" }] }, "amount": { "type": "number" } } } } } },
      "ground_truth": { "title": "Q3 PURCHASES", "headers": ["Item", "Qty", "Amount"], "rows": [{ "item": "Paper", "qty": 2, "amount": 20 }, { "item": "Delivery", "qty": null, "amount": 5 }] },
      "expected": {
        "pages": [{ "page": 1, "modality": "born_digital", "transcript": "Q3 PURCHASES Item Qty Amount Paper 2 USD 20.00 Delivery USD 5.00", "ordered_fragments": ["Q3 PURCHASES", "Item", "Qty", "Amount", "Paper", "2", "USD 20.00", "Delivery", "USD 5.00"] }],